{
  "schema": "field_point_authority_map_v0",
  "authority_status": "diagnostic_non_normative",
  "creates_release_authority": false,
  "invariant": "field_points_must_declare_role_and_authority_status_before_interpretation",
  "normative_materialization_path": [
    "recorded-release-evidence",
    "status-json",
    "declared-gate-policy",
    "materialized-required-gate-set",
    "strict-ci-checking",
    "ci-allow-block-decision"
  ],
  "field_points": [
    {
      "field_point_id": "recorded-release-evidence",
      "path_or_label": "recorded release evidence",
      "surface_type": "recorded_release_evidence",
      "authority_status": "normative_input",
      "field_role": "Safety, quality, detector, stability, CI, and review evidence recorded before deployment.",
      "relation_to_normative_path": "normative_path_member",
      "can_affect_release_decision": true,
      "creates_release_authority": false,
      "policy_route": null
    },
    {
      "field_point_id": "status-json",
      "path_or_label": "status.json",
      "surface_type": "status_artifact",
      "authority_status": "normative_input",
      "field_role": "Machine-readable release state artifact.",
      "relation_to_normative_path": "normative_path_member",
      "can_affect_release_decision": true,
      "creates_release_authority": false,
      "policy_route": null
    },
    {
      "field_point_id": "declared-gate-policy",
      "path_or_label": "pulse_gate_policy_v0.yml",
      "surface_type": "declared_policy",
      "authority_status": "normative_input",
      "field_role": "Declared gate policy defining required gate sets by release lane.",
      "relation_to_normative_path": "normative_path_member",
      "can_affect_release_decision": true,
      "creates_release_authority": false,
      "policy_route": null
    },
    {
      "field_point_id": "materialized-required-gate-set",
      "path_or_label": "materialized required gate set",
      "surface_type": "materialized_gate_set",
      "authority_status": "normative_input",
      "field_role": "Concrete gate set derived from declared policy.",
      "relation_to_normative_path": "normative_path_member",
      "can_affect_release_decision": true,
      "creates_release_authority": false,
      "policy_route": null
    },
    {
      "field_point_id": "strict-ci-checking",
      "path_or_label": "check_gates.py / CI enforcement",
      "surface_type": "ci_enforcement",
      "authority_status": "normative_enforcement",
      "field_role": "True-only fail-closed enforcement over materialized required gates.",
      "relation_to_normative_path": "normative_path_member",
      "can_affect_release_decision": true,
      "creates_release_authority": false,
      "policy_route": null
    },
    {
      "field_point_id": "ci-allow-block-decision",
      "path_or_label": "CI allow/block release decision",
      "surface_type": "ci_decision",
      "authority_status": "normative_decision",
      "field_role": "Deterministic release decision emitted by CI.",
      "relation_to_normative_path": "normative_path_member",
      "can_affect_release_decision": true,
      "creates_release_authority": false,
      "policy_route": null
    },
    {
      "field_point_id": "quality-ledger",
      "path_or_label": "Quality Ledger",
      "surface_type": "quality_ledger",
      "authority_status": "publication_non_normative",
      "field_role": "Human-readable reader surface for the decision trail.",
      "relation_to_normative_path": "publication_reader",
      "can_affect_release_decision": false,
      "creates_release_authority": false,
      "policy_route": null
    },
    {
      "field_point_id": "release-authority-manifest",
      "path_or_label": "release_authority_v0.json",
      "surface_type": "release_authority_manifest",
      "authority_status": "audit_non_normative",
      "field_role": "Trace surface recording decision-path metadata.",
      "relation_to_normative_path": "audit_reconstruction",
      "can_affect_release_decision": false,
      "creates_release_authority": false,
      "policy_route": null
    },
    {
      "field_point_id": "audit-bundle",
      "path_or_label": "release-authority-audit-bundle",
      "surface_type": "audit_bundle",
      "authority_status": "audit_non_normative",
      "field_role": "Reconstructable evidence trail bundle.",
      "relation_to_normative_path": "audit_reconstruction",
      "can_affect_release_decision": false,
      "creates_release_authority": false,
      "policy_route": null
    },
    {
      "field_point_id": "recognition-surface-drift",
      "path_or_label": "recognition_surface_drift_v0",
      "surface_type": "recognition_surface_drift",
      "authority_status": "diagnostic_non_normative",
      "field_role": "Diagnostic contract for presentation-layer capture / recognition-surface drift.",
      "relation_to_normative_path": "diagnostic_observer",
      "can_affect_release_decision": false,
      "creates_release_authority": false,
      "policy_route": null
    },
    {
      "field_point_id": "hpc-evidence-bundle",
      "path_or_label": "hpc_evidence_bundle_v0",
      "surface_type": "hpc_evidence_bundle",
      "authority_status": "diagnostic_non_normative",
      "field_role": "Diagnostic evidence surface for HPC / compute-scale outputs.",
      "relation_to_normative_path": "candidate_evidence_surface",
      "can_affect_release_decision": false,
      "creates_release_authority": false,
      "policy_route": null
    },
    {
      "field_point_id": "evidence-fold-in-admissibility",
      "path_or_label": "evidence_fold_in_admissibility_v0",
      "surface_type": "evidence_fold_in_admissibility",
      "authority_status": "diagnostic_non_normative",
      "field_role": "Diagnostic admissibility boundary before non-normative evidence can approach recorded release evidence.",
      "relation_to_normative_path": "diagnostic_observer",
      "can_affect_release_decision": false,
      "creates_release_authority": false,
      "policy_route": null
    },
    {
      "field_point_id": "pulse-pd",
      "path_or_label": "pulse_pd/",
      "surface_type": "pulse_pd_artifact",
      "authority_status": "optional_analysis_non_normative",
      "field_role": "Optional analysis surface for decision-field exploration.",
      "relation_to_normative_path": "optional_analysis",
      "can_affect_release_decision": false,
      "creates_release_authority": false,
      "policy_route": null
    },
    {
      "field_point_id": "readme",
      "path_or_label": "README.md",
      "surface_type": "readme",
      "authority_status": "recognition_non_normative",
      "field_role": "Recognition and orientation surface.",
      "relation_to_normative_path": "recognition_surface",
      "can_affect_release_decision": false,
      "creates_release_authority": false,
      "policy_route": null
    },
    {
      "field_point_id": "concept-doi",
      "path_or_label": "10.5281/zenodo.17214908",
      "surface_type": "doi_record",
      "authority_status": "publication_non_normative",
      "field_role": "Publication and citation surface.",
      "relation_to_normative_path": "publication_reader",
      "can_affect_release_decision": false,
      "creates_release_authority": false,
      "policy_route": null
    }
  ],
  "result": "valid",
  "notes": "Field points are classified by role and authority status, not architectural distance."
}
